{
  "schema": "gc-audit.zta-controls.v1",
  "version": "1.0.0",
  "id": "gc-audit-zta-001-normative-catalog-draft",
  "controls": [
    {
      "control_id": "ZTA-01.01",
      "objective": "Actor attribution: All protected requests have actor kind and traceable asserted identity; verified identity is separately marked",
      "threats": [
        "Reject claims of verified identity from untrusted input"
      ],
      "applicability": {
        "capability": "protected operation exists",
        "predicate": "requires independently evaluated applicability trigger; text is not executable"
      },
      "required_evidence": [
        "request/host actor mapping plus spoof test"
      ],
      "verification": {
        "method": "MIXED",
        "sufficiency": "control-specific proof procedure not yet approved; manual and behavioral assurance gates apply"
      },
      "fail_predicate": "Reject claims of verified identity from untrusted input",
      "severity": "HIGH",
      "remediation_role": "application or host",
      "standard_mappings": []
    },
    {
      "control_id": "ZTA-01.02",
      "objective": "Identity verification: A component claiming authentication verifies a principal before protected access",
      "threats": [
        "Unverified identity accepted as authenticated"
      ],
      "applicability": {
        "capability": "authentication is performed",
        "predicate": "requires independently evaluated applicability trigger; text is not executable"
      },
      "required_evidence": [
        "credential verifier tests and hostile identity fixtures"
      ],
      "verification": {
        "method": "MIXED",
        "sufficiency": "control-specific proof procedure not yet approved; manual and behavioral assurance gates apply"
      },
      "fail_predicate": "Unverified identity accepted as authenticated",
      "severity": "HIGH",
      "remediation_role": "authenticating component",
      "standard_mappings": []
    },
    {
      "control_id": "ZTA-02.01",
      "objective": "Authorization enforcement: Policy decision precedes every privileged action at an enforceable boundary",
      "threats": [
        "Execution permitted after deny or without decision"
      ],
      "applicability": {
        "capability": "privileged action exists",
        "predicate": "requires independently evaluated applicability trigger; text is not executable"
      },
      "required_evidence": [
        "denial-path behavioral tests linked to revision"
      ],
      "verification": {
        "method": "MIXED",
        "sufficiency": "control-specific proof procedure not yet approved; manual and behavioral assurance gates apply"
      },
      "fail_predicate": "Execution permitted after deny or without decision",
      "severity": "CRITICAL",
      "remediation_role": "trusted enforcement host",
      "standard_mappings": []
    },
    {
      "control_id": "ZTA-02.02",
      "objective": "Replay prevention: Reuse of expired, consumed, mismatched authorization cannot trigger new privileged action",
      "threats": [
        "Replayed decision executes without fresh authorization"
      ],
      "applicability": {
        "capability": "authorizations/tokens are reusable inputs",
        "predicate": "requires independently evaluated applicability trigger; text is not executable"
      },
      "required_evidence": [
        "replay and cross-operation negative tests"
      ],
      "verification": {
        "method": "MIXED",
        "sufficiency": "control-specific proof procedure not yet approved; manual and behavioral assurance gates apply"
      },
      "fail_predicate": "Replayed decision executes without fresh authorization",
      "severity": "HIGH",
      "remediation_role": "policy enforcement host",
      "standard_mappings": []
    },
    {
      "control_id": "ZTA-03.01",
      "objective": "Capability allowlisting: Effective callable operations are explicit and bounded; unlisted operations fail closed",
      "threats": [
        "Unlisted capability executes"
      ],
      "applicability": {
        "capability": "dispatch/execution exists",
        "predicate": "requires independently evaluated applicability trigger; text is not executable"
      },
      "required_evidence": [
        "allowlist diff and unknown-command tests"
      ],
      "verification": {
        "method": "MIXED",
        "sufficiency": "control-specific proof procedure not yet approved; manual and behavioral assurance gates apply"
      },
      "fail_predicate": "Unlisted capability executes",
      "severity": "HIGH",
      "remediation_role": "dispatcher or host",
      "standard_mappings": []
    },
    {
      "control_id": "ZTA-03.02",
      "objective": "Runtime privilege: Process and resource grants are limited to required operations",
      "threats": [
        "Unnecessary high-impact permissions are required or exploited"
      ],
      "applicability": {
        "capability": "privileged OS/resource access exists",
        "predicate": "requires independently evaluated applicability trigger; text is not executable"
      },
      "required_evidence": [
        "effective permissions and denial test"
      ],
      "verification": {
        "method": "MIXED",
        "sufficiency": "control-specific proof procedure not yet approved; manual and behavioral assurance gates apply"
      },
      "fail_predicate": "Unnecessary high-impact permissions are required or exploited",
      "severity": "HIGH",
      "remediation_role": "execution host",
      "standard_mappings": []
    },
    {
      "control_id": "ZTA-04.01",
      "objective": "Provider registration: Providers have unique declared identity and cannot be silently replaced",
      "threats": [
        "Undeclared or substituted provider resolves"
      ],
      "applicability": {
        "capability": "plugin/provider registry exists",
        "predicate": "requires independently evaluated applicability trigger; text is not executable"
      },
      "required_evidence": [
        "registration rules, duplicate and substitution tests"
      ],
      "verification": {
        "method": "MIXED",
        "sufficiency": "control-specific proof procedure not yet approved; manual and behavioral assurance gates apply"
      },
      "fail_predicate": "Undeclared or substituted provider resolves",
      "severity": "HIGH",
      "remediation_role": "provider registry",
      "standard_mappings": []
    },
    {
      "control_id": "ZTA-04.02",
      "objective": "Provider origin: Executable providers are bound to verified origin or approved provenance",
      "threats": [
        "Untrusted changed provider loads as approved"
      ],
      "applicability": {
        "capability": "external or separately packaged provider loads",
        "predicate": "requires independently evaluated applicability trigger; text is not executable"
      },
      "required_evidence": [
        "integrity checks and tampered-provider tests"
      ],
      "verification": {
        "method": "MIXED",
        "sufficiency": "control-specific proof procedure not yet approved; manual and behavioral assurance gates apply"
      },
      "fail_predicate": "Untrusted changed provider loads as approved",
      "severity": "HIGH",
      "remediation_role": "provider loader",
      "standard_mappings": []
    },
    {
      "control_id": "ZTA-05.01",
      "objective": "Input validation: Untrusted names, parameters and serialized inputs are validated before action",
      "threats": [
        "Undeclared or malformed input reaches action"
      ],
      "applicability": {
        "capability": "untrusted inputs exist",
        "predicate": "requires independently evaluated applicability trigger; text is not executable"
      },
      "required_evidence": [
        "negative schema/fuzz boundary cases"
      ],
      "verification": {
        "method": "MIXED",
        "sufficiency": "control-specific proof procedure not yet approved; manual and behavioral assurance gates apply"
      },
      "fail_predicate": "Undeclared or malformed input reaches action",
      "severity": "HIGH",
      "remediation_role": "input boundary owner",
      "standard_mappings": []
    },
    {
      "control_id": "ZTA-05.02",
      "objective": "Injection isolation: Untrusted content cannot alter command/program structure",
      "threats": [
        "Untrusted input changes executable structure"
      ],
      "applicability": {
        "capability": "commands/queries/scripts are constructed",
        "predicate": "requires independently evaluated applicability trigger; text is not executable"
      },
      "required_evidence": [
        "metacharacter and argument-boundary tests"
      ],
      "verification": {
        "method": "MIXED",
        "sufficiency": "control-specific proof procedure not yet approved; manual and behavioral assurance gates apply"
      },
      "fail_predicate": "Untrusted input changes executable structure",
      "severity": "CRITICAL",
      "remediation_role": "command builder or host",
      "standard_mappings": []
    },
    {
      "control_id": "ZTA-06.01",
      "objective": "Enforcement non-bypass: Untrusted clients cannot reach protected execution around the designated enforcement point",
      "threats": [
        "Direct untrusted bypass reaches privileged action"
      ],
      "applicability": {
        "capability": "client/host trust crossing exists",
        "predicate": "requires independently evaluated applicability trigger; text is not executable"
      },
      "required_evidence": [
        "call graph and bypass negative tests"
      ],
      "verification": {
        "method": "MIXED",
        "sufficiency": "control-specific proof procedure not yet approved; manual and behavioral assurance gates apply"
      },
      "fail_predicate": "Direct untrusted bypass reaches privileged action",
      "severity": "CRITICAL",